{
  "schemaVersion": 1,
  "id": "n2-26",
  "unitId": "n2",
  "order": 426,
  "title": "第26课 网络评价的可靠性判断",
  "level": "N2",
  "kind": "scene",
  "objectives": [
    "区分个案与趋势",
    "辨别日期与具体性",
    "补充直接确认"
  ],
  "scene": {
    "background": "林与朋友比较一家虚构店铺的评论，近期评论很少且有极端评价。 本课为原创教学情境，材料所列条件只适用于此情境。",
    "channel": "in-person",
    "tasks": [
      "区分个案与趋势",
      "辨别日期与具体性",
      "补充直接确认"
    ],
    "relationships": "你扮演“我（わたし）”（课文中的林）。林（リン）与友人の佐藤交流。熟悉的朋友或同住者之间采用普通体，双方接受该语体。条件分支与主路径互斥，不把两种结果合并。"
  },
  "learnerSpeakerId": "learner",
  "speakers": [
    {
      "id": "learner",
      "name": "我（わたし）",
      "role": "你扮演的角色（课文示例姓名：林／リン）；在日本学习和生活的学习者，示例读音リン"
    },
    {
      "id": "partner",
      "name": "友人の佐藤",
      "role": "友人の佐藤"
    }
  ],
  "dialogues": [
    {
      "id": "main",
      "title": "主课文：网络评价的可靠性判断",
      "variant": "main",
      "lines": [
        {
          "id": "main-line-1",
          "speakerId": "learner",
          "ja": "評価が高いからといって、今も同じサービスとは限らないね。",
          "zh": "不能因为评价高，就认为现在服务也相同。",
          "reading": "ひょうかがたかいからといって、いまもおなじさーびすとはかぎらないね。",
          "ttsText": "ひょうかがたかいからといって、いまもおなじさーびすとはかぎらないね。"
        },
        {
          "id": "main-line-2",
          "speakerId": "partner",
          "ja": "確かに、最近の書込みは三件しかない。",
          "zh": "确实，近期只有三条评论。",
          "reading": "たしかに、さいきんのかきこみはさんけんしかない。",
          "ttsText": "たしかに、さいきんのかきこみはさんけんしかない。"
        },
        {
          "id": "main-line-3",
          "speakerId": "learner",
          "ja": "極端な意見ばかりに目を向けると、判断を誤りかねない。",
          "zh": "只关注极端意见，可能判断失误。",
          "reading": "きょくたんないけんばかりにめをむけると、はんだんをあやまりかねない。",
          "ttsText": "きょくたんないけんばかりにめをむけると、はんだんをあやまりかねない。"
        },
        {
          "id": "main-line-4",
          "speakerId": "partner",
          "ja": "内容が具体的か、訪問時期が分かるかも見よう。",
          "zh": "也看看内容是否具体、能否知道到访时间。",
          "reading": "ないようがぐたいてきか、ほうもんじきがわかるかもみよう。",
          "ttsText": "ないようがぐたいてきか、ほうもんじきがわかるかもみよう。"
        },
        {
          "id": "main-line-5",
          "speakerId": "learner",
          "ja": "口コミだけに頼ることなく、必要な条件は店に聞こう。",
          "zh": "不要只依赖评论，必要条件直接问店家吧。",
          "reading": "くちこみだけにたよることなく、ひつようなじょうけんはみせにきこう。",
          "ttsText": "くちこみだけにたよることなく、ひつようなじょうけんはみせにきこう。"
        },
        {
          "id": "main-line-6",
          "speakerId": "partner",
          "ja": "営業時間と予約の扱いを先に確認しよう。",
          "zh": "先确认营业时间和预约处理吧。",
          "reading": "えいぎょうじかんとよやくのあつかいをさきにかくにんしよう。",
          "ttsText": "えいぎょうじかんとよやくのあつかいをさきにかくにんしよう。"
        }
      ]
    },
    {
      "id": "branch",
      "title": "条件分支：变化后的沟通",
      "variant": "branch",
      "lines": [
        {
          "id": "branch-line-1",
          "speakerId": "learner",
          "ja": "別のサイトでは評価が逆だった。",
          "zh": "另一个网站上的评价相反。",
          "reading": "べつのさいとではひょうかがぎゃくだった。",
          "ttsText": "べつのさいとではひょうかがぎゃくだった。"
        },
        {
          "id": "branch-line-2",
          "speakerId": "partner",
          "ja": "評価の数と時期が違うかもしれないから、単純に平均しないほうがいい。",
          "zh": "评价数量与时间可能不同，最好不要简单平均。",
          "reading": "ひょうかのかずとじきがちがうかもしれないから、たんじゅんにへいきんしないほうがいい。",
          "ttsText": "ひょうかのかずとじきがちがうかもしれないから、たんじゅんにへいきんしないほうがいい。"
        }
      ]
    }
  ],
  "materials": [
    {
      "id": "situation-note",
      "title": "情境记录与条件说明",
      "kind": "explanation",
      "blocks": [
        {
          "type": "paragraph",
          "ja": "最近の口コミは三件です。サイトごとに評価が異なります。現在の営業時間と予約条件は店へ直接確認します。",
          "zh": "近期评论三条，各网站评价不同；当前营业时间和预约条件直接问店铺。"
        },
        {
          "type": "list",
          "items": [
            {
              "ja": "主経路と分岐は別の状況です。二つの結末を同時に成立した事実として扱わないでください。",
              "zh": "主路径与分支是不同情况，不能把两种结局视为同时成立的事实。"
            }
          ]
        }
      ]
    }
  ],
  "vocabulary": [
    {
      "id": "word-1",
      "word": "書込み",
      "reading": "かきこみ",
      "meaning": "帖子、评论",
      "usage": "用于本课“网络评价的可靠性判断”的沟通任务。",
      "collocations": [
        "最近の書込み"
      ],
      "examples": [
        {
          "ja": "確かに、最近の書込みは三件しかない。",
          "zh": "确实，近期只有三条评论。"
        }
      ],
      "source": {
        "dialogueId": "main",
        "lineId": "main-line-2"
      }
    },
    {
      "id": "word-2",
      "word": "極端",
      "reading": "きょくたん",
      "meaning": "极端",
      "usage": "用于本课“网络评价的可靠性判断”的沟通任务。",
      "collocations": [
        "極端な意見"
      ],
      "examples": [
        {
          "ja": "極端な意見ばかりに目を向けると、判断を誤りかねない。",
          "zh": "只关注极端意见，可能判断失误。"
        }
      ],
      "source": {
        "dialogueId": "main",
        "lineId": "main-line-3"
      }
    },
    {
      "id": "word-3",
      "word": "訪問時期",
      "reading": "ほうもんじき",
      "meaning": "到访时间",
      "usage": "用于本课“网络评价的可靠性判断”的沟通任务。",
      "collocations": [
        "訪問時期が分かる"
      ],
      "examples": [
        {
          "ja": "内容が具体的か、訪問時期が分かるかも見よう。",
          "zh": "也看看内容是否具体、能否知道到访时间。"
        }
      ],
      "source": {
        "dialogueId": "main",
        "lineId": "main-line-4"
      }
    },
    {
      "id": "word-4",
      "word": "口コミ",
      "reading": "くちこみ",
      "meaning": "口碑、评论",
      "usage": "用于本课“网络评价的可靠性判断”的沟通任务。",
      "collocations": [
        "口コミに頼る"
      ],
      "examples": [
        {
          "ja": "口コミだけに頼ることなく、必要な条件は店に聞こう。",
          "zh": "不要只依赖评论，必要条件直接问店家吧。"
        }
      ],
      "source": {
        "dialogueId": "main",
        "lineId": "main-line-5"
      }
    }
  ],
  "expressions": [
    {
      "id": "expression-1",
      "function": "区分个案与趋势",
      "pattern": "〜かねない",
      "meaning": "有可能产生不良结果",
      "audience": "友人の佐藤",
      "notes": [
        "与表示难以做到的かねる不同。",
        "把本课条件、对象或时间换成实际需要的信息；保留例句所表达的限制与语气，不把推测说成已确认。"
      ],
      "slots": [
        {
          "key": "context",
          "description": "可替换本课条件、行动或对象；接续形式见本课文法。"
        }
      ],
      "examples": [
        {
          "ja": "極端な意見ばかりに目を向けると、判断を誤りかねない。",
          "zh": "只关注极端意见，可能判断失误。"
        }
      ],
      "source": {
        "dialogueId": "main",
        "lineId": "main-line-3"
      }
    },
    {
      "id": "expression-2",
      "function": "辨别日期与具体性",
      "pattern": "〜ことなく",
      "meaning": "不做前项而做后项",
      "audience": "友人の佐藤",
      "notes": [
        "不只依赖评论，还要直接确认。",
        "把本课条件、对象或时间换成实际需要的信息；保留例句所表达的限制与语气，不把推测说成已确认。"
      ],
      "slots": [
        {
          "key": "context",
          "description": "可替换本课条件、行动或对象；接续形式见本课文法。"
        }
      ],
      "examples": [
        {
          "ja": "口コミだけに頼ることなく、必要な条件は店に聞こう。",
          "zh": "不要只依赖评论，必要条件直接问店家吧。"
        }
      ],
      "source": {
        "dialogueId": "main",
        "lineId": "main-line-5"
      }
    }
  ],
  "grammar": [
    {
      "id": "grammar-1",
      "pattern": "〜かねない",
      "level": "N2",
      "meaning": "有可能产生不良结果",
      "connection": "动词ます形去ます＋かねない",
      "notes": [
        "与表示难以做到的かねる不同。",
        "等级是本章教学目标的编排标签；本章同时复习基础表达，不声称对应官方逐项文法清单。"
      ],
      "examples": [
        {
          "ja": "極端な意見ばかりに目を向けると、判断を誤りかねない。",
          "zh": "只关注极端意见，可能判断失误。"
        }
      ]
    },
    {
      "id": "grammar-2",
      "pattern": "〜ことなく",
      "level": "N2",
      "meaning": "不做前项而做后项",
      "connection": "动词辞书形＋ことなく",
      "notes": [
        "不只依赖评论，还要直接确认。",
        "等级是本章教学目标的编排标签；本章同时复习基础表达，不声称对应官方逐项文法清单。"
      ],
      "examples": [
        {
          "ja": "口コミだけに頼ることなく、必要な条件は店に聞こう。",
          "zh": "不要只依赖评论，必要条件直接问店家吧。"
        }
      ]
    }
  ],
  "shadowing": [
    {
      "id": "main-practice",
      "dialogueId": "main",
      "lineIds": [
        "main-line-1",
        "main-line-2",
        "main-line-3",
        "main-line-4",
        "main-line-5",
        "main-line-6"
      ],
      "prompt": "听后跟读：先听一句，暂停后模仿。影子跟读：熟悉内容后，在播放过程中稍后跟上，注意条件、转折和句尾语气；两种练习都使用本课原文。"
    },
    {
      "id": "branch-practice",
      "dialogueId": "branch",
      "lineIds": [
        "branch-line-1",
        "branch-line-2"
      ],
      "prompt": "先听后跟读，再尝试影子跟读。留意条件改变后回应如何调整；不要把分支的结果当成主路径已经发生的事实。"
    }
  ],
  "homework": [
    {
      "id": "oral-task",
      "type": "oral",
      "situation": "林与朋友比较一家虚构店铺的评论，近期评论很少且有极端评价。",
      "knownInformation": [
        "最近の口コミは三件です。サイトごとに評価が異なります。現在の営業時間と予約条件は店へ直接確認します。"
      ],
      "tasks": [
        "用口头方式向本课沟通对象说明情况，并提出下一步请求或计划。"
      ],
      "requirements": [
        "说明已确认与未确认内容。",
        "保持人物关系、事实、条件和时间一致。"
      ],
      "hints": [
        "区分个案与趋势",
        "辨别日期与具体性",
        "补充直接确认"
      ],
      "functions": [
        "consult"
      ],
      "answers": [
        {
          "ja": "最近の書込みが少ないので、高評価だけでは決められない。具体性と時期を見て、必要な条件は直接確認したい。",
          "zh": "近期评论少，不能只凭高评价决定；想查看具体性和时间，直接确认必要条件。"
        }
      ]
    },
    {
      "id": "written-task",
      "type": "written",
      "situation": "林与朋友比较一家虚构店铺的评论，近期评论很少且有极端评价。",
      "knownInformation": [
        "最近の口コミは三件です。サイトごとに評価が異なります。現在の営業時間と予約条件は店へ直接確認します。"
      ],
      "tasks": [
        "写一则联络消息或简短报告，说明相关条件、待确认事项与下一步。"
      ],
      "requirements": [
        "用完整自然的日语表达，不必照抄参考答案。",
        "保持原情境事实；条件分支答案仅适用于分支。"
      ],
      "hints": [
        "区分个案与趋势",
        "辨别日期与具体性",
        "补充直接确认"
      ],
      "functions": [
        "contact",
        "report"
      ],
      "answers": [
        {
          "ja": "口コミでは営業時間が異なっていたため、お問い合わせします。現在の営業時間と予約が必要な時間帯を教えてください。",
          "zh": "评论中的营业时间不一致，特此咨询；请告知当前营业时间及需预约的时段。"
        }
      ]
    }
  ],
  "references": [
    {
      "title": "原创生活日语 N2 学习情境",
      "note": "2026-10-04按用户要求创作。不是原项目导出、真实企业或机构的原始记录；费用、政策与流程仅为本课虚构条件。N2为学习目标，不构成考试范围或能力认证。"
    }
  ]
}
