{
  "schemaVersion": 1,
  "id": "n2-51",
  "unitId": "n2",
  "order": 451,
  "title": "第51课 转述公告时保留信息来源",
  "level": "N2",
  "kind": "scene",
  "objectives": [
    "标明来源与时点",
    "区别公告与推测",
    "保持未定信息"
  ],
  "scene": {
    "background": "林读到虚构图书室开放变更公告，与同学讨论哪些时间已经确定。 本课为原创教学情境，材料所列条件只适用于此情境。",
    "channel": "in-person",
    "tasks": [
      "标明来源与时点",
      "区别公告与推测",
      "保持未定信息"
    ],
    "relationships": "你扮演“我（わたし）”（课文中的林）。林（リン）与同級生の佐藤交流。使用礼貌体；称呼与请求按对方职责及本课关系表达。条件分支与主路径互斥，不把两种结果合并。"
  },
  "learnerSpeakerId": "learner",
  "speakers": [
    {
      "id": "learner",
      "name": "我（わたし）",
      "role": "你扮演的角色（课文示例姓名：林／リン）；在日本学习和生活的学习者，示例读音リン"
    },
    {
      "id": "partner",
      "name": "同級生の佐藤",
      "role": "同級生の佐藤"
    }
  ],
  "dialogues": [
    {
      "id": "main",
      "title": "主课文：转述公告时保留信息来源",
      "variant": "main",
      "lines": [
        {
          "id": "main-line-1",
          "speakerId": "learner",
          "ja": "掲示によれば、来週は夕方の利用時間が短くなるそうです。",
          "zh": "据公告，下周傍晚的使用时间将会缩短。",
          "reading": "けいじによれば、らいしゅうはゆうがたのりようじかんがみじかくなるそうです。",
          "ttsText": "けいじによれば、らいしゅうはゆうがたのりようじかんがみじかくなるそうです。"
        },
        {
          "id": "main-line-2",
          "speakerId": "partner",
          "ja": "毎日同じ時刻に閉まるのでしょうか。",
          "zh": "每天都同一时间关门吗？",
          "reading": "まいにちおなじじこくにしまるのでしょうか。",
          "ttsText": "まいにちおなじじこくにしまるのでしょうか。"
        },
        {
          "id": "main-line-3",
          "speakerId": "learner",
          "ja": "表を見る限り、月曜と水曜だけ十七時までです。",
          "zh": "就表格看，只有周一和周三到十七点。",
          "reading": "ひょうをみるかぎり、げつようとすいようだけじゅうしちじまでです。",
          "ttsText": "ひょうをみるかぎり、げつようとすいようだけじゅうしちじまでです。"
        },
        {
          "id": "main-line-4",
          "speakerId": "partner",
          "ja": "ほかの日は通常どおりと考えていいですか。",
          "zh": "其他日期可以认为照常吗？",
          "reading": "ほかのひはつうじょうどおりとかんがえていいですか。",
          "ttsText": "ほかのひはつうじょうどおりとかんがえていいですか。"
        },
        {
          "id": "main-line-5",
          "speakerId": "learner",
          "ja": "そうとは書かれていない以上、確認せずに言い切れません。",
          "zh": "既然没有这样写，未经确认不能断言。",
          "reading": "そうとはかかれていないいじょう、かくにんせずにいいきれません。",
          "ttsText": "そうとはかかれていないいじょう、かくにんせずにいいきれません。"
        },
        {
          "id": "main-line-6",
          "speakerId": "partner",
          "ja": "では、対象の日付と確認先を一緒に伝えましょう。",
          "zh": "那么一起传达相关日期与确认窗口吧。",
          "reading": "では、たいしょうのひづけとかくにんさきをいっしょにつたえましょう。",
          "ttsText": "では、たいしょうのひづけとかくにんさきをいっしょにつたえましょう。"
        }
      ]
    },
    {
      "id": "branch",
      "title": "条件分支：变化后的沟通",
      "variant": "branch",
      "lines": [
        {
          "id": "branch-line-1",
          "speakerId": "learner",
          "ja": "掲示の日付が古いことに気づきました。",
          "zh": "发现公告日期很旧。",
          "reading": "けいじのひづけがふるいことにきづきました。",
          "ttsText": "けいじのひづけがふるいことにきづきました。"
        },
        {
          "id": "branch-line-2",
          "speakerId": "partner",
          "ja": "現在も有効か確認し、古い情報を新しい案内として転送しないでください。",
          "zh": "请确认目前是否有效，不把旧信息当新通知转发。",
          "reading": "げんざいもゆうこうかかくにんし、ふるいじょうほうをあたらしいあんないとしててんそうしないでください。",
          "ttsText": "げんざいもゆうこうかかくにんし、ふるいじょうほうをあたらしいあんないとしててんそうしないでください。"
        }
      ]
    }
  ],
  "materials": [
    {
      "id": "situation-note",
      "title": "情境记录与条件说明",
      "kind": "explanation",
      "blocks": [
        {
          "type": "paragraph",
          "ja": "掲示には来週の月曜と水曜が十七時までとあります。他の日は記載がなく、通常どおりとは断定しません。掲示の有効性も確認します。",
          "zh": "公告写下周周一与周三至十七点，其他日未记载，不断言照常；也确认公告是否有效。"
        },
        {
          "type": "list",
          "items": [
            {
              "ja": "主経路と分岐は別の状況です。二つの結末を同時に成立した事実として扱わないでください。",
              "zh": "主路径与分支是不同情况，不能把两种结局视为同时成立的事实。"
            }
          ]
        }
      ]
    }
  ],
  "vocabulary": [
    {
      "id": "word-1",
      "word": "掲示",
      "reading": "けいじ",
      "meaning": "公告",
      "usage": "用于本课“转述公告时保留信息来源”的沟通任务。",
      "collocations": [
        "掲示によれば"
      ],
      "examples": [
        {
          "ja": "掲示によれば、来週は夕方の利用時間が短くなるそうです。",
          "zh": "据公告，下周傍晚的使用时间将会缩短。"
        }
      ],
      "source": {
        "dialogueId": "main",
        "lineId": "main-line-1"
      }
    },
    {
      "id": "word-2",
      "word": "通常どおり",
      "reading": "つうじょうどおり",
      "meaning": "照常",
      "usage": "用于本课“转述公告时保留信息来源”的沟通任务。",
      "collocations": [
        "通常どおりの運営"
      ],
      "examples": [
        {
          "ja": "ほかの日は通常どおりと考えていいですか。",
          "zh": "其他日期可以认为照常吗？"
        }
      ],
      "source": {
        "dialogueId": "main",
        "lineId": "main-line-4"
      }
    },
    {
      "id": "word-3",
      "word": "対象",
      "reading": "たいしょう",
      "meaning": "相关对象",
      "usage": "用于本课“转述公告时保留信息来源”的沟通任务。",
      "collocations": [
        "対象の日付"
      ],
      "examples": [
        {
          "ja": "では、対象の日付と確認先を一緒に伝えましょう。",
          "zh": "那么一起传达相关日期与确认窗口吧。"
        }
      ],
      "source": {
        "dialogueId": "main",
        "lineId": "main-line-6"
      }
    },
    {
      "id": "word-4",
      "word": "有効",
      "reading": "ゆうこう",
      "meaning": "有效",
      "usage": "用于本课“转述公告时保留信息来源”的沟通任务。",
      "collocations": [
        "現在も有効"
      ],
      "examples": [
        {
          "ja": "現在も有効か確認し、古い情報を新しい案内として転送しないでください。",
          "zh": "请确认目前是否有效，不把旧信息当新通知转发。"
        }
      ],
      "source": {
        "dialogueId": "branch",
        "lineId": "branch-line-2"
      }
    }
  ],
  "expressions": [
    {
      "id": "expression-1",
      "function": "标明来源与时点",
      "pattern": "〜によれば",
      "meaning": "根据某信息来源",
      "audience": "同級生の佐藤",
      "notes": [
        "保留来源，不等于自己已现场确认。",
        "把本课条件、对象或时间换成实际需要的信息；保留例句所表达的限制与语气，不把推测说成已确认。"
      ],
      "slots": [
        {
          "key": "context",
          "description": "可替换本课条件、行动或对象；接续形式见本课文法。"
        }
      ],
      "examples": [
        {
          "ja": "掲示によれば、来週は夕方の利用時間が短くなるそうです。",
          "zh": "据公告，下周傍晚的使用时间将会缩短。"
        }
      ],
      "source": {
        "dialogueId": "main",
        "lineId": "main-line-1"
      }
    },
    {
      "id": "expression-2",
      "function": "区别公告与推测",
      "pattern": "〜以上",
      "meaning": "既然条件成立",
      "audience": "同級生の佐藤",
      "notes": [
        "说明未记载部分不能擅自推断。",
        "把本课条件、对象或时间换成实际需要的信息；保留例句所表达的限制与语气，不把推测说成已确认。"
      ],
      "slots": [
        {
          "key": "context",
          "description": "可替换本课条件、行动或对象；接续形式见本课文法。"
        }
      ],
      "examples": [
        {
          "ja": "そうとは書かれていない以上、確認せずに言い切れません。",
          "zh": "既然没有这样写，未经确认不能断言。"
        }
      ],
      "source": {
        "dialogueId": "main",
        "lineId": "main-line-5"
      }
    }
  ],
  "grammar": [
    {
      "id": "grammar-1",
      "pattern": "〜によれば",
      "meaning": "根据某信息来源",
      "connection": "名词＋によれば",
      "notes": [
        "保留来源，不等于自己已现场确认。",
        "等级是本章教学目标的编排标签；本章同时复习基础表达，不声称对应官方逐项文法清单。"
      ],
      "examples": [
        {
          "ja": "掲示によれば、来週は夕方の利用時間が短くなるそうです。",
          "zh": "据公告，下周傍晚的使用时间将会缩短。"
        }
      ]
    },
    {
      "id": "grammar-2",
      "pattern": "〜以上",
      "level": "N2",
      "meaning": "既然条件成立",
      "connection": "动词／い形容词普通形＋以上；名词／な形容词＋である以上",
      "notes": [
        "说明未记载部分不能擅自推断。",
        "等级是本章教学目标的编排标签；本章同时复习基础表达，不声称对应官方逐项文法清单。"
      ],
      "examples": [
        {
          "ja": "そうとは書かれていない以上、確認せずに言い切れません。",
          "zh": "既然没有这样写，未经确认不能断言。"
        }
      ]
    }
  ],
  "shadowing": [
    {
      "id": "main-practice",
      "dialogueId": "main",
      "lineIds": [
        "main-line-1",
        "main-line-2",
        "main-line-3",
        "main-line-4",
        "main-line-5",
        "main-line-6"
      ],
      "prompt": "听后跟读：先听一句，暂停后模仿。影子跟读：熟悉内容后，在播放过程中稍后跟上，注意条件、转折和句尾语气；两种练习都使用本课原文。"
    },
    {
      "id": "branch-practice",
      "dialogueId": "branch",
      "lineIds": [
        "branch-line-1",
        "branch-line-2"
      ],
      "prompt": "先听后跟读，再尝试影子跟读。留意条件改变后回应如何调整；不要把分支的结果当成主路径已经发生的事实。"
    }
  ],
  "homework": [
    {
      "id": "oral-task",
      "type": "oral",
      "situation": "林读到虚构图书室开放变更公告，与同学讨论哪些时间已经确定。",
      "knownInformation": [
        "掲示には来週の月曜と水曜が十七時までとあります。他の日は記載がなく、通常どおりとは断定しません。掲示の有効性も確認します。"
      ],
      "tasks": [
        "用口头方式向本课沟通对象说明情况，并提出下一步请求或计划。"
      ],
      "requirements": [
        "说明已确认与未确认内容。",
        "保持人物关系、事实、条件和时间一致。"
      ],
      "hints": [
        "标明来源与时点",
        "区别公告与推测",
        "保持未定信息"
      ],
      "functions": [
        "consult"
      ],
      "answers": [
        {
          "ja": "掲示では来週の月曜と水曜は十七時までです。他の日は記載がないので、通常どおりか担当者に確認します。",
          "zh": "公告中下周周一与周三到十七点；其他日未记载，将向负责人确认是否照常。"
        }
      ]
    },
    {
      "id": "written-task",
      "type": "written",
      "situation": "林读到虚构图书室开放变更公告，与同学讨论哪些时间已经确定。",
      "knownInformation": [
        "掲示には来週の月曜と水曜が十七時までとあります。他の日は記載がなく、通常どおりとは断定しません。掲示の有効性も確認します。"
      ],
      "tasks": [
        "写一则联络消息或简短报告，说明相关条件、待确认事项与下一步。"
      ],
      "requirements": [
        "用完整自然的日语表达，不必照抄参考答案。",
        "保持原情境事实；条件分支答案仅适用于分支。"
      ],
      "hints": [
        "标明来源与时点",
        "区别公告与推测",
        "保持未定信息"
      ],
      "functions": [
        "contact",
        "report"
      ],
      "answers": [
        {
          "ja": "掲示の情報を共有します。月曜・水曜は十七時までとの記載がありますが、他の日の扱いと現在の有効性は確認中です。",
          "zh": "共享公告信息；写着周一、周三至十七点，但其他日安排及当前是否有效仍在确认。"
        }
      ]
    }
  ],
  "references": [
    {
      "title": "原创生活日语 N2 学习情境",
      "note": "2026-10-04按用户要求创作。不是原项目导出、真实企业或机构的原始记录；费用、政策与流程仅为本课虚构条件。N2为学习目标，不构成考试范围或能力认证。"
    }
  ]
}
