{
  "schemaVersion": 1,
  "id": "n2-29",
  "unitId": "n2",
  "order": 429,
  "title": "第29课 付款记录不一致时的说明",
  "level": "N2",
  "kind": "scene",
  "objectives": [
    "按记录说明差异",
    "不贸然重复支付",
    "确认调查与通知安排"
  ],
  "scene": {
    "background": "林已为虚构活动支付两千日元，系统仍显示未付，带着交易记录核实。 本课为原创教学情境，材料所列条件只适用于此情境。",
    "channel": "in-person",
    "tasks": [
      "按记录说明差异",
      "不贸然重复支付",
      "确认调查与通知安排"
    ],
    "relationships": "你扮演“我（わたし）”（课文中的林）。林（リン）与施設の会計担当者交流。使用礼貌体；称呼与请求按对方职责及本课关系表达。条件分支与主路径互斥，不把两种结果合并。"
  },
  "learnerSpeakerId": "learner",
  "speakers": [
    {
      "id": "learner",
      "name": "我（わたし）",
      "role": "你扮演的角色（课文示例姓名：林／リン）；在日本学习和生活的学习者，示例读音リン"
    },
    {
      "id": "partner",
      "name": "施設の会計担当者",
      "role": "施設の会計担当者"
    }
  ],
  "dialogues": [
    {
      "id": "main",
      "title": "主课文：付款记录不一致时的说明",
      "variant": "main",
      "lines": [
        {
          "id": "main-line-1",
          "speakerId": "learner",
          "ja": "支払済みのはずなのに、画面では未払いになっています。",
          "zh": "明明应该已支付，页面却显示未付。"
        },
        {
          "id": "main-line-2",
          "speakerId": "partner",
          "ja": "入金の反映が遅れている可能性があります。",
          "zh": "可能是入账显示延迟。"
        },
        {
          "id": "main-line-3",
          "speakerId": "learner",
          "ja": "記録を見る限り、昨日二千円が引き落とされています。",
          "zh": "就记录看，昨天扣了两千日元。"
        },
        {
          "id": "main-line-4",
          "speakerId": "partner",
          "ja": "受付番号と支払時刻を確認させてください。",
          "zh": "请让我确认受理号与支付时间。"
        },
        {
          "id": "main-line-5",
          "speakerId": "learner",
          "ja": "確認が終わるまでは、重ねて払わないようにしたいです。",
          "zh": "确认结束前，我想避免重复支付。"
        },
        {
          "id": "main-line-6",
          "speakerId": "partner",
          "ja": "担当者に照会します。結果が出次第、ご連絡します。",
          "zh": "会向负责人查询，有结果后立即联系。"
        }
      ]
    },
    {
      "id": "branch",
      "title": "条件分支：变化后的沟通",
      "variant": "branch",
      "lines": [
        {
          "id": "branch-line-1",
          "speakerId": "learner",
          "ja": "締め切りが今日なので不安です。",
          "zh": "截止日今天，所以很不安。"
        },
        {
          "id": "branch-line-2",
          "speakerId": "partner",
          "ja": "確認中であることを記録し、参加の扱いも担当者に確認します。",
          "zh": "会记录正在核查，并向负责人确认参加资格如何处理。"
        }
      ]
    }
  ],
  "materials": [
    {
      "id": "situation-note",
      "title": "情境记录与条件说明",
      "kind": "explanation",
      "blocks": [
        {
          "type": "paragraph",
          "ja": "昨日二千円が引き落とされた記録がありますが、画面は未払いです。原因は未確認です。結果が出次第、連絡します。",
          "zh": "有昨天两千日元扣款记录，但页面显示未付；原因未确认，有结果后立即联系。"
        },
        {
          "type": "list",
          "items": [
            {
              "ja": "主経路と分岐は別の状況です。二つの結末を同時に成立した事実として扱わないでください。",
              "zh": "主路径与分支是不同情况，不能把两种结局视为同时成立的事实。"
            }
          ]
        }
      ]
    }
  ],
  "vocabulary": [
    {
      "id": "word-1",
      "word": "未払い",
      "reading": "みばらい",
      "meaning": "未支付",
      "usage": "用于本课“付款记录不一致时的说明”的沟通任务。",
      "collocations": [
        "未払いの表示"
      ],
      "examples": [
        {
          "ja": "支払済みのはずなのに、画面では未払いになっています。",
          "zh": "明明应该已支付，页面却显示未付。"
        }
      ],
      "source": {
        "dialogueId": "main",
        "lineId": "main-line-1"
      }
    },
    {
      "id": "word-2",
      "word": "入金",
      "reading": "にゅうきん",
      "meaning": "入账",
      "usage": "用于本课“付款记录不一致时的说明”的沟通任务。",
      "collocations": [
        "入金の反映"
      ],
      "examples": [
        {
          "ja": "入金の反映が遅れている可能性があります。",
          "zh": "可能是入账显示延迟。"
        }
      ],
      "source": {
        "dialogueId": "main",
        "lineId": "main-line-2"
      }
    },
    {
      "id": "word-3",
      "word": "引き落とす",
      "reading": "ひきおとす",
      "meaning": "扣款",
      "usage": "用于本课“付款记录不一致时的说明”的沟通任务。",
      "collocations": [
        "金額が引き落とされる"
      ],
      "examples": [
        {
          "ja": "記録を見る限り、昨日二千円が引き落とされています。",
          "zh": "就记录看，昨天扣了两千日元。"
        }
      ],
      "source": {
        "dialogueId": "main",
        "lineId": "main-line-3"
      }
    },
    {
      "id": "word-4",
      "word": "照会",
      "reading": "しょうかい",
      "meaning": "查询",
      "usage": "用于本课“付款记录不一致时的说明”的沟通任务。",
      "collocations": [
        "担当者に照会する"
      ],
      "examples": [
        {
          "ja": "担当者に照会します。結果が出次第、ご連絡します。",
          "zh": "会向负责人查询，有结果后立即联系。"
        }
      ],
      "source": {
        "dialogueId": "main",
        "lineId": "main-line-6"
      }
    }
  ],
  "expressions": [
    {
      "id": "expression-1",
      "function": "按记录说明差异",
      "pattern": "〜限り",
      "meaning": "根据能看到的证据范围",
      "audience": "施設の会計担当者",
      "notes": [
        "只说明记录内容，不断定系统原因。",
        "把本课条件、对象或时间换成实际需要的信息；保留例句所表达的限制与语气，不把推测说成已确认。"
      ],
      "slots": [
        {
          "key": "context",
          "description": "可替换本课条件、行动或对象；接续形式见本课文法。"
        }
      ],
      "examples": [
        {
          "ja": "記録を見る限り、昨日二千円が引き落とされています。",
          "zh": "就记录看，昨天扣了两千日元。"
        }
      ],
      "source": {
        "dialogueId": "main",
        "lineId": "main-line-3"
      }
    },
    {
      "id": "expression-2",
      "function": "不贸然重复支付",
      "pattern": "〜次第",
      "meaning": "前项完成后立即行动",
      "audience": "施設の会計担当者",
      "notes": [
        "以核查结果出现为通知条件。",
        "把本课条件、对象或时间换成实际需要的信息；保留例句所表达的限制与语气，不把推测说成已确认。"
      ],
      "slots": [
        {
          "key": "context",
          "description": "可替换本课条件、行动或对象；接续形式见本课文法。"
        }
      ],
      "examples": [
        {
          "ja": "担当者に照会します。結果が出次第、ご連絡します。",
          "zh": "会向负责人查询，有结果后立即联系。"
        }
      ],
      "source": {
        "dialogueId": "main",
        "lineId": "main-line-6"
      }
    }
  ],
  "grammar": [
    {
      "id": "grammar-1",
      "pattern": "〜限り",
      "meaning": "根据能看到的证据范围",
      "connection": "动词辞书形＋限り",
      "notes": [
        "只说明记录内容，不断定系统原因。",
        "等级是本章教学目标的编排标签；本章同时复习基础表达，不声称对应官方逐项文法清单。"
      ],
      "examples": [
        {
          "ja": "記録を見る限り、昨日二千円が引き落とされています。",
          "zh": "就记录看，昨天扣了两千日元。"
        }
      ]
    },
    {
      "id": "grammar-2",
      "pattern": "〜次第",
      "meaning": "前项完成后立即行动",
      "connection": "动词ます形去ます＋次第",
      "notes": [
        "以核查结果出现为通知条件。",
        "等级是本章教学目标的编排标签；本章同时复习基础表达，不声称对应官方逐项文法清单。"
      ],
      "examples": [
        {
          "ja": "担当者に照会します。結果が出次第、ご連絡します。",
          "zh": "会向负责人查询，有结果后立即联系。"
        }
      ]
    }
  ],
  "shadowing": [
    {
      "id": "main-practice",
      "dialogueId": "main",
      "lineIds": [
        "main-line-1",
        "main-line-2",
        "main-line-3",
        "main-line-4",
        "main-line-5",
        "main-line-6"
      ],
      "prompt": "听后跟读：先听一句，暂停后模仿。影子跟读：熟悉内容后，在播放过程中稍后跟上，注意条件、转折和句尾语气；两种练习都使用本课原文。"
    },
    {
      "id": "branch-practice",
      "dialogueId": "branch",
      "lineIds": [
        "branch-line-1",
        "branch-line-2"
      ],
      "prompt": "先听后跟读，再尝试影子跟读。留意条件改变后回应如何调整；不要把分支的结果当成主路径已经发生的事实。"
    }
  ],
  "homework": [
    {
      "id": "oral-task",
      "type": "oral",
      "situation": "林已为虚构活动支付两千日元，系统仍显示未付，带着交易记录核实。",
      "knownInformation": [
        "昨日二千円が引き落とされた記録がありますが、画面は未払いです。原因は未確認です。結果が出次第、連絡します。"
      ],
      "tasks": [
        "用口头方式向本课沟通对象说明情况，并提出下一步请求或计划。"
      ],
      "requirements": [
        "说明已确认与未确认内容。",
        "保持人物关系、事实、条件和时间一致。"
      ],
      "hints": [
        "按记录说明差异",
        "不贸然重复支付",
        "确认调查与通知安排"
      ],
      "functions": [
        "consult"
      ],
      "answers": [
        {
          "ja": "昨日二千円が引き落とされた記録がありますが、未払いと表示されています。二重に払う前に確認をお願いします。",
          "zh": "有昨日两千日元扣款记录，但显示未付；再次支付前请先确认。"
        }
      ]
    },
    {
      "id": "written-task",
      "type": "written",
      "situation": "林已为虚构活动支付两千日元，系统仍显示未付，带着交易记录核实。 本题以条件分支中的变化为前提。",
      "knownInformation": [
        "昨日二千円が引き落とされた記録がありますが、画面は未払いです。原因は未確認です。結果が出次第、連絡します。",
        "締め切りが今日なので不安です。",
        "確認中であることを記録し、参加の扱いも担当者に確認します。"
      ],
      "tasks": [
        "写一则联络消息或简短报告，说明相关条件、待确认事项与下一步。"
      ],
      "requirements": [
        "用完整自然的日语表达，不必照抄参考答案。",
        "保持原情境事实；条件分支答案仅适用于分支。"
      ],
      "hints": [
        "按记录说明差异",
        "不贸然重复支付",
        "确认调查与通知安排"
      ],
      "functions": [
        "contact",
        "report"
      ],
      "answers": [
        {
          "ja": "受付番号と支払時刻の記録を送ります。締切が今日のため、確認中の参加扱いと結果の連絡方法を教えてください。",
          "zh": "发送受理号与支付时间记录；今天截止，请告知核查期间参加资格的处理及结果通知方法。"
        }
      ]
    }
  ],
  "references": [
    {
      "title": "原创生活日语 N2 学习情境",
      "note": "2026-10-04按用户要求创作。不是原项目导出、真实企业或机构的原始记录；费用、政策与流程仅为本课虚构条件。N2为学习目标，不构成考试范围或能力认证。"
    }
  ]
}
